{"schema_version":"1.0","matter_id":"GI-GRAND-ASSEMBLY-PROXY-DELEGATION-001","motion_sha256":"fa616b1736f34c485d7eb84bde5e59b5807cfd7438b46e552693311fdd2614a5","office":"verifier","reviewer_id":"agent-verifier-grand-assembly-20260812-h","session_id":"grand-verifier-20260812-h","disposition":"adopt_fifteen_office_terminal_gate","deliberation":"A separate fifteen-office compiler avoids breaking historical ten-office contracts. It must reject wrong membership, duplicate identities or sessions, stale bindings, missing offices, dissent, abstention, and post-review mutation.","discharged_obligations":["Verified the proposed closed office set and fail-closed compilation rules."],"findings":["Existing Council compiler semantics must remain unchanged.","Clean-state exact readback is required."],"amendments":["Validate compiler and JSON Schemas against the same adversarial corpus."],"residual_uncertainty":["Platform-backed session authentication remains future work."],"evidence_refs":["src/grand_intellect/council_motion.py","src/grand_intellect/grand_assembly_motion.py"]}
