{"schema_version":"1.0","matter_id":"GI-GRAND-ASSEMBLY-PROXY-DELEGATION-001","motion_sha256":"fa616b1736f34c485d7eb84bde5e59b5807cfd7438b46e552693311fdd2614a5","office":"amanuensis","reviewer_id":"agent-amanuensis-grand-assembly-20260812-n","session_id":"grand-amanuensis-20260812-n","disposition":"adopt_fifteen_office_terminal_gate","deliberation":"The record must preserve the original 10/10 motions and schedule receipt as immutable predecessors, then add the fifteen-office amendment and future terminal records as linked successors. No prior record may be relabelled.","discharged_obligations":["Specified durable inscription, indexing, custody, and inheritance."],"findings":["Compression must be lossless by reference.","Each future packet revision requires a new identity."],"amendments":["Index proceeding, packet, office, reviewer, session, supersession, and terminal outcome."],"residual_uncertainty":["Cross-repository evidence custody is not yet implemented."],"evidence_refs":["governance/committees/GI-PROXY-DELEGATION-COMMITTEE-001-SCHEDULE-001-RECEIPT.json","governance/grand_assembly_matters/GI-GRAND-ASSEMBLY-PROXY-DELEGATION-001/proposal.md"]}
