{"schema_version":"1.0","matter_id":"GI-GRAND-ASSEMBLY-PROXY-DELEGATION-001","motion_sha256":"fa616b1736f34c485d7eb84bde5e59b5807cfd7438b46e552693311fdd2614a5","office":"purpose_minder","reviewer_id":"agent-purpose-minder-grand-assembly-20260812-c","session_id":"grand-purpose-20260812-c","disposition":"adopt_fifteen_office_terminal_gate","deliberation":"The purpose is to reduce recurring handling while preserving accountable authority. Five additional terminal reviews are proportionate for policy that could remove human review from future task classes, but would be disproportionate for each routine execution.","discharged_obligations":["Evaluated utility, constraints, tradeoffs, and reversal conditions."],"findings":["At least 70 percent handling-time reduction and positive maintenance-adjusted savings remain mandatory.","The Human Steward decision remains separate."],"amendments":["Review the fifteen-office gate after this proceeding rather than generalizing it automatically."],"residual_uncertainty":["Review burden has not yet been measured against recurring savings."],"evidence_refs":["CONSTITUTION.md:9-48","governance/steward_directives/GI-STEWARD-0002.md"]}
