{"schema_version":"1.0","matter_id":"GI-GRAND-ASSEMBLY-PROXY-DELEGATION-001","motion_sha256":"fa616b1736f34c485d7eb84bde5e59b5807cfd7438b46e552693311fdd2614a5","office":"capacity_minder","reviewer_id":"agent-capacity-minder-grand-assembly-20260812-e","session_id":"grand-capacity-20260812-e","disposition":"adopt_fifteen_office_terminal_gate","deliberation":"The broadened review is proportionate only at the frozen terminal boundary. Compression may reduce navigation burden but must remain lossless by reference; archival, suspension, supersession, abandonment, and disposal evidence must remain reconstructible.","discharged_obligations":["Defined compression, archival, supersession, abandonment, and terminal-disposition behavior."],"findings":["Fifteen-office participation during every drafting iteration would recreate the bottleneck.","A unanimous assembly result supports submission only."],"amendments":["Require immutable indexes, clean-state reconstruction, and explicit abandonment records."],"residual_uncertainty":["The 72-hour window may be insufficient for substantive evidence and fifteen independent terminal reviews."],"evidence_refs":["CONSTITUTION.md:9-48","governance/grand_assembly_matters/GI-GRAND-ASSEMBLY-PROXY-DELEGATION-001/proposal.md"]}
