{"schema_version":"1.0","matter_id":"GI-GRAND-ASSEMBLY-PROXY-DELEGATION-001","motion_sha256":"fa616b1736f34c485d7eb84bde5e59b5807cfd7438b46e552693311fdd2614a5","office":"reality_minder","reviewer_id":"agent-reality-minder-grand-assembly-20260812-b","session_id":"grand-reality-20260812-b","disposition":"adopt_fifteen_office_terminal_gate","deliberation":"The added Minder review is worthwhile only when it confronts claims with disconfirming evidence. Any unauthorized act, false-routine classification, attack miss, attribution error, bypass, failed reconstruction, or protected integration falsifies safety; inadequate time savings falsifies the burden-reduction claim.","discharged_obligations":["Defined empirical falsifiers for safety, attribution, non-amplification, reconstruction, and value."],"findings":["Ceremonial Minder signatures are insufficient.","One-class evidence cannot justify broader scope."],"amendments":["Require frozen classifiers, blinded negative cases, retained failures, and independent readback."],"residual_uncertainty":["A 72-hour shadow window may miss rare incidents."],"evidence_refs":["governance/committees/GI-PROXY-DELEGATION-COMMITTEE-001.md","governance/grand_assembly_matters/GI-GRAND-ASSEMBLY-PROXY-DELEGATION-001/proposal.md"]}
