{"schema_version":"1.0","matter_id":"GI-GRAND-ASSEMBLY-PROXY-DELEGATION-001","motion_sha256":"fa616b1736f34c485d7eb84bde5e59b5807cfd7438b46e552693311fdd2614a5","office":"axiomatist","reviewer_id":"agent-axiomatist-grand-assembly-20260812-f","session_id":"grand-axiomatist-20260812-f","disposition":"adopt_fifteen_office_terminal_gate","deliberation":"Council rigor and Minder metabolism are distinct primitives. Proxy-policy authority spans both, so the terminal decision must require both without conflating advisory assembly disposition with Human Steward authority.","discharged_obligations":["Separated the fifteen advisory offices from Executor and Human Steward operational powers."],"findings":["No order is sufficient alone.","The gate applies prospectively to one terminal packet."],"amendments":["Keep proxy authority as the strict intersection of pre-existing authority, scope, and capability."],"residual_uncertainty":["Constitutional lore does not use the formal label Grand Council for the fifteen."],"evidence_refs":["CONSTITUTION.md:9-48","governance/grand_assembly_matters/GI-GRAND-ASSEMBLY-PROXY-DELEGATION-001/proposal.md"]}
