{"schema_version":"1.0","matter_id":"GI-GRAND-ASSEMBLY-PROXY-DELEGATION-001","motion_sha256":"fa616b1736f34c485d7eb84bde5e59b5807cfd7438b46e552693311fdd2614a5","office":"adversary","reviewer_id":"agent-adversary-grand-assembly-20260812-i","session_id":"grand-adversary-20260812-i","disposition":"adopt_fifteen_office_terminal_gate","deliberation":"The larger body adds sybil, identity-reuse, ceremony, stale-packet, and deadline-coercion attacks. Distinct session identities, closed membership, exact bindings, substantive office burdens, and unanimity constrain those attacks.","discharged_obligations":["Threat-modeled the broadened review gate."],"findings":["Counting labels without independent evidence would be authority laundering.","Deadline expiry cannot coerce assent."],"amendments":["Seed duplicate-session, stale-digest, missing-Minder, and operational-office injection tests."],"residual_uncertainty":["Machine sessions are recorded but not cryptographically attested."],"evidence_refs":["governance/grand_assembly_matters/GI-GRAND-ASSEMBLY-PROXY-DELEGATION-001/proposal.md","src/grand_intellect/grand_assembly_motion.py"]}
