{"schema_version":"1.0","matter_id":"GI-GRAND-ASSEMBLY-PROXY-DELEGATION-001","motion_sha256":"fa616b1736f34c485d7eb84bde5e59b5807cfd7438b46e552693311fdd2614a5","office":"referee","reviewer_id":"agent-referee-grand-assembly-20260812-o","session_id":"grand-referee-20260812-o","disposition":"adopt_fifteen_office_terminal_gate","deliberation":"Fourteen prior exact-motion-bound office records are present with unique reviewer and session identities. I independently concur that the programme's terminal policy gate requires five Minders and ten Council offices unanimously, while the valid historical 10/10 records retain their limited effects and Human Steward authority remains separate.","discharged_obligations":["Verified membership, identity separation, exact binding, substantive obligations, unanimity, and authority boundaries."],"findings":["Full fifteen-office quorum is present.","All fifteen dispositions are the sole affirmative disposition.","The outcome adopts a prospective terminal review gate only."],"amendments":["At terminal review, the Referee must compile only after fourteen fresh exact-packet records exist."],"residual_uncertainty":["The complete terminal packet and its fifteen future reviews do not yet exist."],"evidence_refs":["governance/grand_assembly_matters/GI-GRAND-ASSEMBLY-PROXY-DELEGATION-001/motion.json","governance/grand_assembly_matters/GI-GRAND-ASSEMBLY-PROXY-DELEGATION-001/reviews"]}
