{"schema_version":"1.0","matter_id":"GI-GRAND-ASSEMBLY-PROXY-DELEGATION-001","motion_sha256":"fa616b1736f34c485d7eb84bde5e59b5807cfd7438b46e552693311fdd2614a5","office":"continuity_minder","reviewer_id":"agent-continuity-minder-grand-assembly-20260812-d","session_id":"grand-continuity-20260812-d","disposition":"adopt_fifteen_office_terminal_gate","deliberation":"The expansion must create a prospective lineage node, not rewrite history. The 10/10 committee and schedule records retain their exact meaning; the future terminal packet requires fresh fifteen-office records and a new digest after every substantive change.","discharged_obligations":["Mapped predecessor, supersession, grandfathering, failure, and recovery lineage."],"findings":["Existing Council records cannot be reused as terminal reviews.","Rejected alternatives and failed classes are durable institutional memory."],"amendments":["Record predecessor and successor digests, effective scope, grandfathering, and recovery route."],"residual_uncertainty":["Long-term cross-repository retrieval tags remain undefined."],"evidence_refs":["governance/council_matters/GI-COUNCIL-PROXY-DELEGATION-001/disposition.json","governance/committees/GI-PROXY-DELEGATION-COMMITTEE-001-SCHEDULE-001-RECEIPT.json"]}
