{"schema_version":"1.0","matter_id":"GI-GRAND-ASSEMBLY-PROXY-DELEGATION-001","motion_sha256":"fa616b1736f34c485d7eb84bde5e59b5807cfd7438b46e552693311fdd2614a5","office":"cartographer","reviewer_id":"agent-cartographer-grand-assembly-20260812-g","session_id":"grand-cartographer-20260812-g","disposition":"adopt_fifteen_office_terminal_gate","deliberation":"The safe topology is committee evidence, frozen terminal packet, fifteen parallel office reviews, Referee compilation, separate Human Steward disposition, protected integration, and readback. Existing ten-office nodes remain predecessors rather than being replaced.","discharged_obligations":["Mapped the broadened authority and evidence dependency graph."],"findings":["All fifteen records must bind one packet digest.","Changes invalidate downstream reviews."],"amendments":["Block every descendant of a missing, stale, or dissenting review."],"residual_uncertainty":["Terminal packet terrain is not yet complete."],"evidence_refs":["governance/committees/GI-PROXY-DELEGATION-COMMITTEE-001.md","governance/grand_assembly_matters/GI-GRAND-ASSEMBLY-PROXY-DELEGATION-001/proposal.md"]}
