{"schema_version":"1.0","matter_id":"GI-GRAND-ASSEMBLY-PROXY-DELEGATION-001","motion_sha256":"fa616b1736f34c485d7eb84bde5e59b5807cfd7438b46e552693311fdd2614a5","office":"grammarian","reviewer_id":"agent-grammarian-grand-assembly-20260812-l","session_id":"grand-grammarian-20260812-l","disposition":"adopt_fifteen_office_terminal_gate","deliberation":"The Constitution formally names the ten as Council and the five as Minders. Grand assembly is the controlled term for their combined fifteen-office proceeding; it must not imply that Executor or Human Steward are voters or that assembly concurrence is ratification.","discharged_obligations":["Normalized Grand assembly, Council, Minder, operational office, submission, and authorization terms."],"findings":["Grand Council is lore shorthand, not the constitutional office heading.","The exact record must say fifteen-office Grand assembly."],"amendments":["Use distinct labels for assembly disposition and Human Steward authorization."],"residual_uncertainty":["External lore may continue using Grand Council ambiguously."],"evidence_refs":["CONSTITUTION.md:9-52","governance/grand_assembly_matters/GI-GRAND-ASSEMBLY-PROXY-DELEGATION-001/proposal.md"]}
