{"schema_version":"1.0","matter_id":"GI-GRAND-ASSEMBLY-PROXY-DELEGATION-001","motion_sha256":"fa616b1736f34c485d7eb84bde5e59b5807cfd7438b46e552693311fdd2614a5","office":"formalist","reviewer_id":"agent-formalist-grand-assembly-20260812-j","session_id":"grand-formalist-20260812-j","disposition":"adopt_fifteen_office_terminal_gate","deliberation":"The rule is executable when the ordered fifteen-office set, unique reviewer and session identities, exact digest, sole affirmative disposition, and failure state are closed predicates. Unknown evaluates false.","discharged_obligations":["Converted the broadened quorum into an executable contract."],"findings":["Fifteen is exact, not a minimum count.","Executor and Human Steward are excluded from advisory quorum."],"amendments":["Use a versioned Grand assembly schema and compiler."],"residual_uncertainty":["The future terminal-packet schema remains pending."],"evidence_refs":["schemas/grand_assembly_motion.schema.json","src/grand_intellect/grand_assembly_motion.py"]}
