{"schema_version":"1.0","matter_id":"GI-GRAND-ASSEMBLY-PROXY-DELEGATION-001","motion_sha256":"fa616b1736f34c485d7eb84bde5e59b5807cfd7438b46e552693311fdd2614a5","office":"possibility_minder","reviewer_id":"agent-possibility-minder-grand-assembly-20260812-a","session_id":"grand-possibility-20260812-a","disposition":"adopt_fifteen_office_terminal_gate","deliberation":"Proxy delegation crosses the whole epistemic metabolism. A terminal-only fifteen-office gate preserves alternatives without imposing fifteen-office review on routine execution. The ten-office records remain valid predecessors but cannot stand in for fresh review of the terminal packet.","discharged_obligations":["Compared ten-office, fifteen-office, advisory-Minder, preflight, and supermajority alternatives."],"findings":["Fifteen-office unanimity best satisfies the rule that no constitutional order is sufficient alone.","The expansion must be prospective and terminal-only."],"amendments":["Preserve rejected designs and reversal conditions in the exact terminal packet."],"residual_uncertainty":["The larger veto surface may delay disposition."],"evidence_refs":["CONSTITUTION.md:9-48","governance/grand_assembly_matters/GI-GRAND-ASSEMBLY-PROXY-DELEGATION-001/proposal.md"]}
