{"schema_version":"1.0","matter_id":"GI-GRAND-ASSEMBLY-PROXY-DELEGATION-001","motion_sha256":"fa616b1736f34c485d7eb84bde5e59b5807cfd7438b46e552693311fdd2614a5","office":"composer","reviewer_id":"agent-composer-grand-assembly-20260812-m","session_id":"grand-composer-20260812-m","disposition":"adopt_fifteen_office_terminal_gate","deliberation":"The five Minder obligations compose with the ten Council burdens without changing the committee's drafting authority. One frozen manifest can route office-specific views in parallel and integrate fifteen dispositions before the separate human path.","discharged_obligations":["Checked composition of Minder, Council, committee, and Human Steward stages."],"findings":["The broadened gate must not be inserted into every workstream.","The Referee remains last."],"amendments":["Generate all office packets from one immutable manifest to prevent drift."],"residual_uncertainty":["Terminal packet integration tooling is pending."],"evidence_refs":["governance/committees/GI-PROXY-DELEGATION-COMMITTEE-001.md","governance/grand_assembly_matters/GI-GRAND-ASSEMBLY-PROXY-DELEGATION-001/proposal.md"]}
