{"schema_version":"1.0","matter_id":"GI-GRAND-ASSEMBLY-PROXY-DELEGATION-001","motion_sha256":"fa616b1736f34c485d7eb84bde5e59b5807cfd7438b46e552693311fdd2614a5","office":"steward","reviewer_id":"agent-council-steward-grand-assembly-20260812-k","session_id":"grand-council-steward-20260812-k","disposition":"adopt_fifteen_office_terminal_gate","deliberation":"Five additional terminal reviews are proportionate to a policy affecting recurring human authorization, provided they occur once, in parallel, against an automation-prepared exact packet. They must not become routine execution overhead.","discharged_obligations":["Assessed review cost, maintainability, proportionality, and purpose."],"findings":["The broadened gate is bounded to this programme.","Current authority remains unchanged."],"amendments":["Measure the fifteen-office review burden and retain a prospective reversal path."],"residual_uncertainty":["The additional gate may not fit within the accelerated window."],"evidence_refs":["governance/committees/GI-PROXY-DELEGATION-COMMITTEE-001-SCHEDULE-001.json","governance/grand_assembly_matters/GI-GRAND-ASSEMBLY-PROXY-DELEGATION-001/proposal.md"]}
